{
  "schemaVersion": "1",
  "profileId": "kinotch-fixed",
  "packId": "legacy-kanji",
  "sourcePack": "legacy",
  "label": "旧字変換",
  "kind": "dictionary-rules",
  "phraseRules": [],
  "characterMapPriority": 10,
  "characterMap": {
    "医": "醫",
    "悦": "悅",
    "奥": "奧",
    "横": "橫",
    "欧": "歐",
    "殴": "毆",
    "会": "會",
    "学": "學",
    "巌": "巖",
    "却": "卻",
    "旧": "舊",
    "峡": "峽",
    "挟": "挾",
    "狭": "狹",
    "区": "區",
    "群": "羣",
    "径": "徑",
    "携": "攜",
    "茎": "莖",
    "鶏": "鷄",
    "献": "獻",
    "恒": "恆",
    "号": "號",
    "国": "國",
    "参": "參",
    "惨": "慘",
    "蚕": "蠶",
    "残": "殘",
    "辞": "辭",
    "湿": "濕",
    "写": "寫",
    "寿": "壽",
    "処": "處",
    "叙": "敍",
    "将": "將",
    "床": "牀",
    "称": "稱",
    "証": "證",
    "条": "條",
    "嘱": "囑",
    "触": "觸",
    "寝": "寢",
    "晋": "晉",
    "尽": "盡",
    "随": "隨",
    "数": "數",
    "枢": "樞",
    "声": "聲",
    "静": "靜",
    "窃": "竊",
    "浅": "淺",
    "潜": "潛",
    "践": "踐",
    "禅": "禪",
    "双": "雙",
    "壮": "壯",
    "捜": "搜",
    "争": "爭",
    "装": "裝",
    "属": "屬",
    "堕": "墮",
    "体": "體",
    "滞": "滯",
    "担": "擔",
    "胆": "膽",
    "断": "斷",
    "痴": "癡",
    "昼": "晝",
    "虫": "蟲",
    "猪": "猪",
    "点": "點",
    "党": "黨",
    "盗": "盜",
    "灯": "燈",
    "当": "當",
    "独": "獨",
    "届": "屆",
    "麦": "麥",
    "蛮": "蠻",
    "浜": "濱",
    "弁": "辨",
    "宝": "寶",
    "万": "萬",
    "弥": "彌",
    "薮": "藪",
    "与": "與",
    "誉": "譽",
    "遥": "遙",
    "来": "來",
    "乱": "亂",
    "掠": "畧",
    "励": "勵",
    "礼": "禮",
    "恋": "戀",
    "炉": "爐",
    "楼": "樓",
    "禄": "祿",
    "亘": "亙",
    "彎": "灣",
    "歿": "沒",
    "獎": "奬",
    "瑶": "瑤",
    "穗": "瓣",
    "舖": "辯",
    "邊": "邉",
    "凜": "凛",
    "鬭": "鬪"
  }
}
